{
  "schemaVersion": 1,
  "name": "three-participant-signet-circle",
  "network": "signet",
  "currentBlockHeight": 200,
  "manifest": {
    "created": "2026-08-01T18:00:00Z",
    "expires": "2026-08-01T19:00:00Z",
    "kind": "circle",
    "nonce": "90e8f5cf27f04c89a6657bc9c60e3021",
    "orbit": "signet-builders",
    "protocol": "witc",
    "title": "Reference genesis circle",
    "version": 1
  },
  "canonicalManifest": "{\"created\":\"2026-08-01T18:00:00Z\",\"expires\":\"2026-08-01T19:00:00Z\",\"kind\":\"circle\",\"nonce\":\"90e8f5cf27f04c89a6657bc9c60e3021\",\"orbit\":\"signet-builders\",\"protocol\":\"witc\",\"title\":\"Reference genesis circle\",\"version\":1}",
  "contextHash": "ad2608134839e732280cb93bdd5b8682626dce5748a65c437a39cdcb680c2a82",
  "markerScript": "6a285749544301020103ad2608134839e732280cb93bdd5b8682626dce5748a65c437a39cdcb680c2a82",
  "rawTransaction": "0200000000010311111111111111111111111111111111111111111111111111111111111111110000000000fdffffff22222222222222222222222222222222222222222222222222222222222222220100000000fdffffff33333333333333333333333333333333333333333333333333333333333333330200000000fdffffff0400000000000000002a6a285749544301020103ad2608134839e732280cb93bdd5b8682626dce5748a65c437a39cdcb680c2a82767000000000000022512079be667ef9dcbbac55a06295ce870b07029bfcdb2dce28d959f2815b16f817988697000000000000225120c6047f9441ed7d6d3045406e95c07cd85c778e4b8cef3ca7abac09b95c709ee596be000000000000225120f9308a019258c31049344f85f89d5229b531c845836f99b08601f113bce036f9014047a7e18e28d613b3d8069411b0a358cd0a21d76c0b83365353a489fa57c87468a412103b8a37a516d8bc43252a8885d9fc8867b434ebd59aaf5370fe64e5b27f014055ea013bfa12a13007dce24e534a0e7214f32296a8265ce03f0d34ded964d45e129f53b4b8d386fe853f7cf070c887f21109b9e75fd8361c440bcbdd46ddd9340140c2582f9aaa3e02673371f43c0663dd2c636455015924c1ebe163a3f9a45991bfb2c5abb634d4c1693d41762a537d1768836d0e398e4c480fc101b3c994a1ce7f00000000",
  "txid": "3703d5b332ebf2871a0a24066f7ea4b84dd3e9ebca1b1a879140e844c64b0f65",
  "wtxid": "772b6d1d179e6f5ba1c4699486a754ef7681b6299ee0e023fc2a5dd0c11245ab",
  "feeSats": "3630",
  "virtualBytes": 363,
  "prevouts": [
    {
      "txid": "1111111111111111111111111111111111111111111111111111111111111111",
      "vout": 0,
      "valueSats": "30000",
      "scriptPubKey": "512079be667ef9dcbbac55a06295ce870b07029bfcdb2dce28d959f2815b16f81798",
      "blockHeight": 199
    },
    {
      "txid": "2222222222222222222222222222222222222222222222222222222222222222",
      "vout": 1,
      "valueSats": "40000",
      "scriptPubKey": "5120c6047f9441ed7d6d3045406e95c07cd85c778e4b8cef3ca7abac09b95c709ee5",
      "blockHeight": 199
    },
    {
      "txid": "3333333333333333333333333333333333333333333333333333333333333333",
      "vout": 2,
      "valueSats": "50000",
      "scriptPubKey": "5120f9308a019258c31049344f85f89d5229b531c845836f99b08601f113bce036f9",
      "blockHeight": 199
    }
  ],
  "expectedLineageIds": [
    "4bc0f5c804bffee98f9d5239c11d6b9ed7473af856c6f9709763cb44276f5617",
    "63c22eae014513dbabfffe84db6131635ce44e066156be0a396b9db4f2dc18b7",
    "ee745631e7bea77a35e38ed050e495c0a5eafca41cef5dd59ce7243b5aceacdb"
  ],
  "stateTransition": {
    "blockHeight": 200,
    "blockHash": "aaaaaaaaaaaaaaaaaaaaaaaaaaaaaaaaaaaaaaaaaaaaaaaaaaaaaaaaaaaaaaaa",
    "transactionIndex": 4,
    "expectedStateHash": "07b97f0c2cbaa172e66a2137fefbee64c5a05f03e03967d46936cd14070523f1"
  }
}
